{
  "schemaVersion": "eval-app-profile.v1",
  "id": "quick",
  "version": "1.4.0",
  "title": "Quick diagnosis",
  "description": "One clean/control trial for each critical nightly smoke case. The user controls the total budget and its per-case allocation.",
  "baseTier": "nightly",
  "suites": [{ "suiteId": "hope-core-orchestration", "caseTags": ["smoke_nightly"] }],
  "allowedArms": ["control", "team_full_control", "single_agent_compute_matched_control"],
  "armMode": "one_control_per_case",
  "defaultRepetitions": 1,
  "useSuiteRepetitions": false,
  "maxTrials": 32,
  "maxModels": 4,
  "maxConcurrency": 500,
  "defaultConcurrency": 4,
  "maxCostUsd": 1000000,
  "defaultCostUsd": 100,
  "budgetMode": "user_configurable",
  "allowCustom": false
}
